[
    {
        "id": "tcp-vs-udp",
        "title": "TCP vs UDP",
        "description": "Understand the differences between TCP and UDP.",
        "category": "Networking",
        "level": "Intermediate",
        "readTime": "10 min read",
        "keywords": "networking, tcp, udp, protocol, transport",
        "url": "tutorials/networking/tcp-vs-udp.html",
        "publishedAt": "2026-08-24",
        "updatedAt": "2026-08-24"
    },
    {
        "id": "what-is-dns",
        "title": "What Is DNS?",
        "description": "Learn how the Domain Name System works.",
        "category": "Networking",
        "level": "Beginner",
        "readTime": "8 min read",
        "keywords": "networking, dns, domain, name, system, ip, dns records",
        "url": "tutorials/networking/what-is-dns.html",
        "publishedAt": "2026-08-22",
        "updatedAt": "2026-08-22"
    },
    {
        "id": "what-is-vlan",
        "title": "What Is VLAN?",
        "description": "Learn VLAN concepts, types, benefits and practical use cases.",
        "category": "Networking",
        "level": "Beginner",
        "readTime": "9 min read",
        "keywords": "vlan, switch, network, broadcast domain, tag",
        "url": "tutorials/networking/what-is-vlan.html",
        "publishedAt": "2026-05-16",
        "updatedAt": "2026-05-16"
    },
    {
        "id": "what-is-a-mac-address",
        "title": "What Is a MAC Address?",
        "description": "Learn about the 48-bit physical address used in Layer 2 networks.",
        "category": "Networking",
        "level": "Beginner",
        "readTime": "6 min read",
        "keywords": "mac, address, physical, layer 2, hardware, unicast",
        "url": "tutorials/networking/what-is-a-mac-address.html",
        "publishedAt": "2026-08-25",
        "updatedAt": "2026-08-25"
    },
    {
        "id": "what-is-arp",
        "title": "What Is ARP?",
        "description": "Understand how the Address Resolution Protocol maps IP addresses to MAC addresses.",
        "category": "Networking",
        "level": "Intermediate",
        "readTime": "7 min read",
        "keywords": "arp, address resolution, layer 2, layer 3, mapping",
        "url": "tutorials/networking/what-is-arp.html",
        "publishedAt": "2026-08-25",
        "updatedAt": "2026-08-25"
    },
    {
        "id": "what-is-a-subnet-mask",
        "title": "What Is a Subnet Mask?",
        "description": "Learn how subnet masks divide IP addresses into network and host portions.",
        "category": "Networking",
        "level": "Beginner",
        "readTime": "6 min read",
        "keywords": "subnet mask, network, host, ip, cidr",
        "url": "tutorials/networking/what-is-a-subnet-mask.html",
        "publishedAt": "2026-08-25",
        "updatedAt": "2026-08-25"
    },
    {
        "id": "subnetting-basics",
        "title": "Subnetting Basics",
        "description": "Learn how to divide a single network into multiple smaller subnets.",
        "category": "Networking",
        "level": "Intermediate",
        "readTime": "10 min read",
        "keywords": "subnetting, cidr, vlsm, broadcast, network address",
        "url": "tutorials/networking/subnetting-basics.html",
        "publishedAt": "2026-08-25",
        "updatedAt": "2026-08-25"
    },
    {
        "id": "osi-model-explained",
        "title": "OSI Model Explained",
        "description": "Understand the 7 layers of the OSI model for network troubleshooting.",
        "category": "Networking",
        "level": "Intermediate",
        "readTime": "12 min read",
        "keywords": "osi, model, layers, troubleshooting, application, physical",
        "url": "tutorials/networking/osi-model-explained.html",
        "publishedAt": "2026-08-25",
        "updatedAt": "2026-08-25"
    },
    {
        "id": "tcp-ip-model-explained",
        "title": "TCP/IP Model Explained",
        "description": "Learn the practical 4-layer network model that drives the Internet.",
        "category": "Networking",
        "level": "Intermediate",
        "readTime": "8 min read",
        "keywords": "tcp/ip, model, layers, internet, network access",
        "url": "tutorials/networking/tcp-ip-model-explained.html",
        "publishedAt": "2026-08-25",
        "updatedAt": "2026-08-25"
    },
    {
        "id": "common-network-ports",
        "title": "Common Network Ports",
        "description": "A quick reference guide for essential TCP and UDP ports.",
        "category": "Networking",
        "level": "Beginner",
        "readTime": "5 min read",
        "keywords": "ports, tcp, udp, list, reference, firewall",
        "url": "tutorials/networking/common-network-ports.html",
        "publishedAt": "2026-08-25",
        "updatedAt": "2026-08-25"
    },
    {
        "id": "what-is-nat",
        "title": "What Is NAT?",
        "description": "Learn how Network Address Translation allows private IP addresses to access the Internet.",
        "category": "Networking",
        "level": "Intermediate",
        "readTime": "8 min read",
        "keywords": "nat, network address translation, pat, public ip, private ip",
        "url": "tutorials/networking/what-is-nat.html",
        "publishedAt": "2026-08-25",
        "updatedAt": "2026-08-25"
    },
    {
        "id": "router-vs-switch",
        "title": "Router vs Switch",
        "description": "Understand the critical differences between Layer 2 Switches and Layer 3 Routers.",
        "category": "Networking",
        "level": "Beginner",
        "readTime": "6 min read",
        "keywords": "router, switch, layer 2, layer 3, routing, switching",
        "url": "tutorials/networking/router-vs-switch.html",
        "publishedAt": "2026-08-25",
        "updatedAt": "2026-08-25"
    },
    {
        "id": "hub-vs-switch",
        "title": "Hub vs Switch",
        "description": "Learn why modern networks use Switches instead of legacy Hubs.",
        "category": "Networking",
        "level": "Beginner",
        "readTime": "4 min read",
        "keywords": "hub, switch, collision domain, legacy, layer 1, layer 2",
        "url": "tutorials/networking/hub-vs-switch.html",
        "publishedAt": "2026-08-25",
        "updatedAt": "2026-08-25"
    },
    {
        "id": "lan-vs-wan",
        "title": "LAN vs WAN",
        "description": "Networks are categorized by their geographic scope. The two most common types are LAN and WAN.",
        "category": "Networking",
        "level": "Beginner",
        "readTime": "5 min read",
        "keywords": "networking, lan vs wan",
        "url": "tutorials/networking/lan-vs-wan.html",
        "publishedAt": "UNKNOWN",
        "updatedAt": "UNKNOWN"
    },
    {
        "id": "ping-explained",
        "title": "Ping Explained",
        "description": "Ping is a network utility used to test the reachability of a host on an IP network. It sends ICMP Echo Request packets and waits for an Echo Reply.",
        "category": "Networking",
        "level": "Beginner",
        "readTime": "5 min read",
        "keywords": "networking, ping explained",
        "url": "tutorials/networking/ping-explained.html",
        "publishedAt": "UNKNOWN",
        "updatedAt": "UNKNOWN"
    },
    {
        "id": "public-vs-private-ip-address",
        "title": "Public vs Private IP Address",
        "description": "IP addresses are split into public and private ranges to conserve addresses and improve security.",
        "category": "Networking",
        "level": "Intermediate",
        "readTime": "5 min read",
        "keywords": "networking, public vs private ip address",
        "url": "tutorials/networking/public-vs-private-ip-address.html",
        "publishedAt": "UNKNOWN",
        "updatedAt": "UNKNOWN"
    },
    {
        "id": "traceroute-explained",
        "title": "Traceroute Explained",
        "description": "Traceroute is a utility that records the route (the specific gateway computers at each hop) through the internet between your computer and a specified...",
        "category": "Networking",
        "level": "Intermediate",
        "readTime": "5 min read",
        "keywords": "networking, traceroute explained",
        "url": "tutorials/networking/traceroute-explained.html",
        "publishedAt": "UNKNOWN",
        "updatedAt": "UNKNOWN"
    },
    {
        "id": "what-is-a-computer-network",
        "title": "What Is a Computer Network?",
        "description": "A computer network is a group of computers connected together to communicate and share resources, such as internet connections, printers, or files.",
        "category": "Networking",
        "level": "Beginner",
        "readTime": "5 min read",
        "keywords": "networking, what is a computer network",
        "url": "tutorials/networking/what-is-a-computer-network.html",
        "publishedAt": "UNKNOWN",
        "updatedAt": "UNKNOWN"
    },
    {
        "id": "what-is-a-default-gateway",
        "title": "What Is a Default Gateway?",
        "description": "A Default Gateway is the device (usually a router) that traffic is sent to when the destination IP address is outside the local network (LAN).",
        "category": "Networking",
        "level": "Beginner",
        "readTime": "5 min read",
        "keywords": "networking, what is a default gateway",
        "url": "tutorials/networking/what-is-a-default-gateway.html",
        "publishedAt": "UNKNOWN",
        "updatedAt": "UNKNOWN"
    },
    {
        "id": "what-is-an-ip-address",
        "title": "What Is an IP Address?",
        "description": "An IP (Internet Protocol) address is a unique numerical label assigned to every device connected to a computer network that uses the Internet Protocol...",
        "category": "Networking",
        "level": "Beginner",
        "readTime": "5 min read",
        "keywords": "networking, what is an ip address",
        "url": "tutorials/networking/what-is-an-ip-address.html",
        "publishedAt": "UNKNOWN",